Transporter,Address,Numbers,Contact Person
INDIAN TRANSPORT COMANY,"room 1&2- subham hostel- near puliya- road no. 14- vki area- jaipur - 13 , jaipur","Contact No : 9314429699, 9214429699,",Contact Person : hoshiar singh
KERLA CARGO MOVERS OF INDAI,"murlipura jaipur , jaipur","Contact No : 9351378368, , 9351378368",Contact Person : satveer singh
VIKRAMADITYA LOGISTICS PVT. LTD.,"near pink pearl water park- narsinghpura- ajmer road- jaipur , jaipur","Contact No : 9351453745, 9414053745, 2259045,",Contact Person : randhir singh
DEVYANI INT. PACKERS & MOVERS,"opp. harsh hotel- delhi-ajmer high road no.14- vki area- jaipur , jaipur","Contact No : 9829196642, 9352296642, ,",Contact Person : sk nehra
DALCHAND CARRIER,"sabji mandi ke samne- road no 14- vki area jaipur , jaipur","Contact No : 8432662697, 7737730145, ,",Contact Person : ramesh saini
PREM CARGO MOVERS PVT. LTD.,"e-776/111- lal kothi- scheme- jaipur , jaipur","Contact No : 9414036230, 9314613841, 9314111968, 0141, 2742386, 2741062,",Contact Person : dinesh patni
SHANKAR PACKERS & MOVERS,"shop no.15- godara complex- road no.14- vki area- jaipur , jaipur","Contact No : 9829343166, 9828655156, 3193166,",Contact Person : sanjay dadhich
ARC TRANS LOGISTICS P. LTD.,"a-105- sangam colony- road no.14- vki area- jaipur , jaipur","Contact No : 9352860342, 9214400000, 3296550,",Contact Person : rakesh sharma
GREEN CARRIERS & CONTRACTOR (DELHI) PVT. LTD.,"e-14- transport nagar- jaipur , jaipur","Contact No : 9309288800, 0141, 3297827, 3261551,",Contact Person : navneet joshi
NAVDEEP CARGO & LOGISTICS SERVICE,"s-10-jagdishpuri-delhi-ajmer by pass- macheda- jaipur , jaipur","Contact No : 9981673505, 9571572666, 8619007592, 9571572666",Contact Person : sunil nehra
RAHUL PACKERS & MOVERS,"2- road no.4 vki , jaipur","Contact No : 9462099193, 9314709267, , 9314709267",Contact Person : nk sharma
FAST INDIA RELOCATION,"plot no.110- shyam enclave- sirsi road- panchawala- jaipur , jaipur","Contact No : 9351551779, 7568310284, ,",Contact Person : NULL
JAI MILAN ROAD CARRIER,"suncity ke samne-surpanch mil ke pas-birpipali-sikar road , jaipur","Contact No : 9460166888, 9785032232, 9309337977, 0141, 3156607,",Contact Person : jai singh chodhari
JAIPUR JABALPUR TRANSPORT COMPANY,"godara complex road no. 14 vkia jaipur , jaipur","Contact No : 9314028392, 9314528392, 9829064814, 9460258384, , 9314028392",Contact Person : anil choudhary
THE GOLDEN TRANSPORT CORP.,"b-4- transport nagar , jaipur","Contact No : 9314095754, 9828295754, 0141, 2640109, 3249609, 3249605,",Contact Person : sahil gaba
ARUN SELVAN LOGISTICS PVT. LTD.,"71-a- sangam colony- near delhi ajmer bypass- road no.14- v.k.i. area- jaipur , jaipur","Contact No : 9342582530, 9309333280, ,",Contact Person : NULL
MAHENDRA TRANSPORT CO.,"a-1 - tranasport nagar , jaipur","Contact No : 9829062920, 0141, 2641625,",Contact Person : sunny maker
OM GURU KRIPA TRANSPORT COMPANY,"r1 central colony opp. road no. 9 behind hotel galaxy inn sikar road jaipur , jaipur","Contact No : 9799999461, , 9799999461",Contact Person : ashok
TK CARGO,"new loha mandi road jaipur , jaipur","Contact No : 9462238337, , 9462238337",Contact Person : pradeep khardia
SKYLINE PACKERS & MOVERS,"h.no.151- rajini vihar- ajmer road- jaipur , jaipur","Contact No : 9928513200, 9529013200, ,",Contact Person : NULL
JAIPUR AHMEDABAD TRANSPORT CO.,"s-67-rico complex -road no-14- vki area , jaipur","Contact No : 9214436278, ,",Contact Person : subash ji
SUNIL ROADWAYS PVT. LTD.,"plot no.118- shir kadam vihar society- opp. sarna dungar ind. area- khora road- benad- jaipur , jaipur","Contact No : 9352016521, 9461278460, 7877775948, ,",Contact Person : rajesh choudhary
JBTO (INDIA) PRIVATE LTD.,"sansar chandra road- jaipur , jaipur","Contact No : , 2375875, 2368415,",Contact Person : pradeep binani
JAIPUR DHOLPUR TRANSPORT CARRIER P.LTD.,"e 819 road no.14 vki area jaipur , jaipur","Contact No : 8696936603, 9414076701, 8696936601",Contact Person : vk jain
TK CARGO,"new loha mandi road jaipur , jaipur","Contact No : 9462238337, , 9462238337",Contact Person : pradeep khardia
MARUTI MOTOR TRANSPORT CO. P. LTD.,"alsisa house- sc road- jaipur , jaipur","Contact No : 9214446505, 2366049,",Contact Person : NULL
VR LOGISTICS,"a-105 sangam colony near anaj mandi gate road no.14 v.k.i.a jaipur , jaipur","Contact No : 9352844505, 7877310890, , 9352844505",Contact Person : dharmpal bhuria
SAHARA EXPORESS PRIVATE LIMITED,"b-140- road no.9-d- vki area- jaipur , jaipur","Contact No : , 23332981, 85,",Contact Person : sk tank
CAPITAL PACKERS & MOVERS,"1- corner khandelwal mkt.- sc road jaipur , jaipur","Contact No : 9351492126, ,",Contact Person : NULL
DGFC PVT. LTD.,"jai singhpura mod- bhankrota- ajmer road- jaipur , jaipur","Contact No : 9414053745, 9351753745, 2259044,",Contact Person : vikram singh shekhawat
RIGHTWAYS CONTAINER TRANSPORT P. LTD.,"b-5- anaj mandi- chandpole- jaipur , jaipur","Contact No : 9829019605, 9414053161, 2375605,",Contact Person : nimit gupta
VIKAS INTERNATIONAL MOVER & PACKERS,"10-a- subhas colony- near k nehru nagar- ajmer road- jaipur , jaipur","Contact No : 9352202287, 9782063287, 9352409031, ,",Contact Person : shankar lal
JAI RUPADA DHAM ROADLINES PVT. LTD.,"new chungi naka- ajmer road- keshavpura bus stop- jaipur , jaipur","Contact No : 9314508069, 9414052506, 2250571, 2251235,",Contact Person : ashok rungta
AGARWAL PACKERS AND MOVERS,"e - 16- nandpuri. near hanuman mandir- bais godam- sodala jaipur- rajasthan , jaipur","Contact No : , 8890605998,",Contact Person : sushil sharma
RAHUL PACKERS & MOVERS,"2- road no.4 vki , jaipur","Contact No : 9462099193, 9314709267, , 9314709267",Contact Person : nk sharma
GURJAR ROAD LINES,"gurjar road lines -icd concor nearsharma dharma kanta kamakura jaipur raj. , jaipur","Contact No : 9414024400, 9414024401, 02,",Contact Person : tejsingh gurjar
GANPATI LOGISTICS,"f-11 tp nagar , jaipur","Contact No : 9352685011, 01412643938,",Contact Person : ashok kumar swami
JAIPUR GOODS CARRIER,"todi mode jaipur , jaipur","Contact No : 7372976683, , 7372976683",Contact Person : abhishek pareek
TRANSKING RELOCATION,"plot.no.426-rajni vihar heerapura jaipur , jaipur","Contact No : 9024225566, , 9024225566",Contact Person : deepak
MEHRAB MOTORS PVT. LTD.,"d-25- jagan path- sardar patel marg- c-scheme jaipur , jaipur","Contact No : 9413333786, 9413343791, 4025860, 9251008786",Contact Person : NULL
KALYAN ROAD LINES,"a-18 transport nagar jaipur , jaipur","Contact No : 9468652505, 8562546464, ,",Contact Person : kalyan sahai
PROFESSIONAL AUTOMOTIVES PVT. LTD.,"a-1- kcc nagar new chungi naka- ajmer road- bhankrota- jaipur , jaipur","Contact No : 9928491374, 9829057801, 9829334821, 0141, 2251285, 2251101, 3235251,",Contact Person : alok agarwal
DREAM PACKERS & MOVERS,"shop no.5- b-163- kanha vihar- 200ft. bypass- vaishali nagar , jaipur","Contact No : 9352013728, 9261593572, ,",Contact Person : dinesh kumar
GREEN FREIGHT CARRIER,"opp.road no.4 vki area jaipur , jaipur","Contact No : 9414064586, 9001609291, 9414064586",Contact Person : satyendra pal
INDIAN GOODS TRANSPORT COMPANY,"d-3- transport nagar , jaipur","Contact No : 9314060852, 0141, 3138374,",Contact Person : rajesh sharma
BHARTH TRANSPORT CORP.,"22-b bypass cyrcle- road no-14 - sikar road , jaipur","Contact No : 9829293235, 8386095950, 9314297677, 0141, 3234915,",Contact Person : rajendra swami
CONTINENTAL CARRIER OF INDIA,"road no 14 v k i area jaipur , jaipur","Contact No : 9352698081, , 9352698081",Contact Person : vikas bindal
TRANSWAY FREIGHT CARRIERS PVT. LTD.,"a-1- chandpole anaj mandi- s.c. road- jaipur , jaipur","Contact No : 9414055090, 2370733, 2360733,",Contact Person : ml jhanwar
OMDEO PACKERS & MOVERS PVT LTD,"b 92- kanha vihar- 60ft road- bhura patel marg- vaishali nagar , jaipur","Contact No : 9314413711, 9314439377,",Contact Person : daya nand singh
SUPERSONIC EXPRESS PVT. LTD.,"house no. - 417c- near heerapura power house- ajmer road- jagadamba nagar b- jaipur- rajasthan , jaipur","Contact No : , 9829205550,",Contact Person : sushil sharma
BAJAJ PARIVAHAN PVT. LTD.,"c-16- tp nagar- jaipur , jaipur","Contact No : 9414047887, 2643116, 5112694,",Contact Person : arun bajaj
CROWN PACKERS & MOVERS,"plot no.54- sangam colony- loha mandi mod- road no.14- vki area- jaipur , jaipur","Contact No : 9352905921, 9694448224, 3141664,",Contact Person : mahendra pareek
AMPS SERVES 4U,"jaipur , jaipur","Contact No : 7976506449, 917976506449,",Contact Person : ishwar singh
A-VISHAL MOVERS & PACKERS PVT. LTD.,"d-5- 200ft. road- satya colony- ajmer byepass road- jaipur , jaipur","Contact No : 9928208296, 6500912,",Contact Person : pradeep choudhary
RAHUL PACKERS & MOVERS,"2- road no.4 vki , jaipur","Contact No : 9462099193, 9314709267, , 9314709267",Contact Person : nk sharma
JEET CARRIERS,"a-15- transport nagar , jaipur","Contact No : 9829051172, 0141, 2640660, 2642660, 2643660, 4019660,",Contact Person : manpreet singh khurana
APEX LOGISITCS,"kcc nagar- old chungi naka- ajmer road- jaipur , jaipur","Contact No : 9309401777, 9784201544, ,",Contact Person : balvant
K M TRANS LOGISTICS PVT LTD,"55 jai nagar opp. vkia road no. 2 sikar road jaipur , jaipur","Contact No : 9829016328, 6622008,",Contact Person : amit chandwar
VARUNA INTEGRATED LOGISTICS PVT. LTD,"f-6- e-20- tranasport nagar , jaipur","Contact No : 9309081490, 9314178703, ,",Contact Person : devendra tiwari
OM RELOCATION SERVICES PVT. LTD.,"shop no.b-6- plot no.536- sector-2- chitrakoot scheme- near pratap stadium- north gate- jaipur , jaipur","Contact No : 9414322584, 9252420123, 0141, 2350663,",Contact Person : NULL
BHORUKA ROADWAYS INDIA PVT. LTD.,"shop no.1- 2- 3- kamla markt- near bhadharna pulia- milan cinema road- vki area- jaipur , jaipur","Contact No : 9314420213, 9351056640, ,",Contact Person : rp sharma
GTT LOGISTICS PVT LTD,"jaipur , jaipur","Contact No : , 9251088861,",Contact Person : ishwar singh
WELL INDIA PACKERS & MOVERS,"d-5/1- satya colony- tagore- pradeep bhardwaj- byepass- ajmer road- jaipur , jaipur","Contact No : 9982792029, 6540378,",Contact Person : us choudhary
HIND TRANSPORT CO.,"near badarana sabji mandi-200 foot bypass road-vki area- jaipur , jaipur","Contact No : 8890067042, 9352969521, , 9352969521",Contact Person : pradeep pareek
JAI SHREE TRANSPORT CO.,"shop no -6-1st flore -vki area-sohan nagar , jaipur","Contact No : 9887721641, ,",Contact Person : vedprakash verma
VINOD CARRIER PVT. LTD.,"227- jalpura- sc road- jaipur , jaipur","Contact No : , 3265355, 3265344,",Contact Person : sunil gupta
PARASMANI ROADLINES PVT. LTD.,"25 tp nagar- jaipur , jaipur","Contact No : , 2642516, 2641094,",Contact Person : sunil jain
SUGAM PARIVAHAN PVT. LTD.,"b-21- transport nagar , jaipur","Contact No : 9414746732, 0141, 2643976,",Contact Person : ravindra
RAJESH MOTORS (AGE.) PVT. LTD.,"behind agarwal petrol pump- nh-8- ramchandrapur- ajmer road- jaipur , jaipur","Contact No : 9414053153, 9414057016, ,",Contact Person : NULL
CENTURY GLOBASL LOGISITCS PVT. LTD.,"b-26- transport nagar- jaipur , jaipur","Contact No : 9351412833, 26411393, 3141902,",Contact Person : NULL
AGARWAL SPEEDLINK P. LTD.,"38- industrial area- jhotwara- jaipur , jaipur","Contact No : 8824321361, 9314624661, ,",Contact Person : pradeep pareek
KSH LOGISTICS PVT. LTD.,"goner road mod- tonk road- jaipur , jaipur","Contact No : 9887713576, ,",Contact Person : NULL
DGS TRANSLOGISTICS INDIA PVT LTD,"g-465- 9a- vki- area jaipur , jaipur","Contact No : 9649908582, 8107788861, 9649908582",Contact Person : ishwar singh choudhary
NIMAWAT ROADLINES,"sikar road jaipur , jaipur","Contact No : 9785307959, 9462094806, ,",Contact Person : sunil kumar
ECONOMIC EXPRESS PVT. LTD.,"g-3- tp nagar- jaipur , jaipur","Contact No : 9352722300, 4019775,",Contact Person : manikand ojha
SAHARA INDIA PACKERS & MOVERS,"l-4- g-2- ganga ram ki dhani- chitrakoot scheme- vaishali nagar- jaipur , jaipur","Contact No : 9352335135, ,",Contact Person : sk choudhary
KALPANA LOGISTIC PVT. LTD.,"b-10/32- automobile nagar- near dharm kanta- jaipur , jaipur","Contact No : 9414071616, 921401616, 9413342426, 9783772000, 0141, 2642426, 2642436,",Contact Person : narayan sharma
ECONOMIC LOGISTIC LIMITED,"b 19 tp nagar jaipur , jaipur","Contact No : 9351313574, 2640273, 9351313574",Contact Person : pholcand
DARBAR TRANSPORT COMPANY,"a-29 , jaipur","Contact No : 9829056695, 4006695, 9829056695",Contact Person : harshneet singh
ASHOK FREIGHT CARRIERS PVT. LTD.,"40- keshav nagar- near new octroi post- bhankrota- ajmer road- jaipur , jaipur","Contact No : 9828151997, 9828551997, 0141, 2250809, 2250163,",Contact Person : ashok sharma
BHOMIK TRANSPORT COMPANY,"road number 14 vki area jaipur , jaipur","Contact No : 9509838690, 9352955914, , 9509838690",Contact Person : dinesh kumar dharmendra kumar
WIPRO PACKERS & MOVERS,"8- new chungi naka- ajmer road- jaipur , jaipur","Contact No : 9468884352, 9351889032, 3124682,",Contact Person : ashok sharma
DINESH CARGO CARRIERS P. LTD.,"f-49-alankar plaza-central spine-vidhyadharnagar , jaipur","Contact No : 01412232864, 09314502529,",Contact Person : dinesh bhardwaj
NIDHI ROAD LINES,"swran path 30/63/01 mansarovar jaipur , jaipur","Contact No : 9314449465, 9785366665, , 9314449465",Contact Person : raju singhal
GLOBE ECOLOGISTICS PVT. LTD.,"d-10- transport nagar- jaipur , jaipur","Contact No : 9352327798, 9314648285, 0141, 2641606,",Contact Person : mool chand kumawat
NARESH ROADLINES P. LTD.,"j-235- deepak marg- adarsh nagar- jaipur , jaipur","Contact No : 9414358430, 9314510264, 2604342, 3265842, 2610387,",Contact Person : pravin kumar jain
ASHIRWAD TRUCK TRALLER TR.CO.,"g-15 - tranasport nagar , jaipur","Contact No : 9460000000, 0141, 2642000,",Contact Person : s. bakhtawar singh
VR LOGISTICS,"a-105 sangam colony near anaj mandi gate road no.14 v.k.i.a jaipur , jaipur","Contact No : 9352844505, 7877310890, , 9352844505",Contact Person : dharmpal bhuria
MAHAVEER TRANS CARRIERS PVT. LTD.,"14- tp nagar- jaipur , jaipur","Contact No : 8290444444, 9166444444, 2641263,",Contact Person : sanjay kumar jain
MATOLIYA ROADLINE,"sikar road todi , jaipur","Contact No : 7891604802, 9079257626, 7891604802",Contact Person : kailash sharma
RAJESH MOTOR (PINK CITY) PVT. LTD.,"1170-1175- near delhi public school- nh-8- bhankrota- jaipur , jaipur","Contact No : , 0141, 3027676, 77,",Contact Person : NULL
JAIN CARRIERS PRIVATE LIMITED,"j-3- transport nagar- jaipur , jaipur","Contact No : , 2640024, 5116169,",Contact Person : brij lal
THE AMRITSAR TRANSPORT CO. PVT. LTD.,"d-16- transport nagar- jaipur , jaipur","Contact No : 9950152793, 2641434, 2564769,",Contact Person : sudhir singh
GURJAR ROAD LINES,"gurjar road lines -icd concor nearsharma dharma kanta kamakura jaipur raj. , jaipur","Contact No : 9414024400, 9414024401, 02,",Contact Person : tejsingh gurjar
DGS TRANSLOGISTICS INDIA PVT LTD,"g-465- 9a- vki- area jaipur , jaipur","Contact No : 9649908582, 8107788861, 9649908582",Contact Person : ishwar singh choudhary
HIMACHAL PANJAB TRANSPORT CO.,"ramnagar badrana sabji mandi - road no-14- delhi bypass- v.k. i area , jaipur","Contact No : 9414322984, 9784763290, 7737194686, 0141, 2333784, 3151704,",Contact Person : anand singh
SHITAL TRANSPORT COMPANY,"2/274 vidhyadhar nagar , jaipur","Contact No : 9829069835, 0141233568,",Contact Person : sumer singh
DINESH CARGO CARRIERS PVT LTD,"f-49-alankar plaza-centra , jaipur","Contact No : 1412232864, 9314502529,",Contact Person : diinesh k bhardwaj
OMKAR TRANSPORT CO. PVT. LTD.,"b-27- transport nagar- jaipur , jaipur","Contact No : , 2640702,",Contact Person : jasbir singh
JAIPUR DHOLAPUR TRANSPORT CARRIER PVT. LTD.,"81-84 transport nagar , jaipur","Contact No : 9414076701, 0141, 2642187, 2643858, 4034685,",Contact Person : arvind garg
SURAT GOODS TRANSPORT PVT. LTD.,"sharma associates- 3rd floor- new octroi naka- kcc nagar- ajmer road- bhankrota- jaipur , jaipur","Contact No : 9314011988, ,",Contact Person : dalip sharma
JAIPUR DAUSA TRANSPORT CO.,"s-64-rico complex -road no-14- vki area , jaipur","Contact No : 9461261462, ,",Contact Person : simhu dayal
JAIPUR JHOREHOT TRANSPORT CO.,"21- 1st flore- transport nagar , jaipur","Contact No : 9314243647, 9413344746, 0141, 2641250, 2641187,",Contact Person : vedprakash sharma
NEW INDIA TRANSLINE PVT. LTD.,"road no.5- vki area- jaipur , jaipur","Contact No : 8058290000, 8058390000, 2330055, 2331555,",Contact Person : deepak batra
SHRI LAXMI TRANSPORT COMPANY,"3059 kalyan ji ka rasta 3rd cross chandpol bazar jaipur , jaipur","Contact No : 7742153840, , 7742153840",Contact Person : anil kumar sharma
AIR TRANSPORT CORPN. ASSAM PVT. LTD.,"f-5- transport nagar- jaipur , jaipur","Contact No : 9352250603, ,",Contact Person : jaibir sharma
RDB AUTO SERVICES PVT. LTD.,"25- k.m.- nh-8- rdb auto complex- bagru , jaipur","Contact No : 9929373477, 9950570177, 9982065060, ,",Contact Person : NULL
SA TRANSPORT COMPANY,"opp. jodla power house- sikar road- vki area- jaipur , jaipur","Contact No : 9314010098, 8562010098, 8440058729, ,",Contact Person : chirangi lal sharma
VR LOGISTICS,"a-105 sangam colony near anaj mandi gate road no.14 v.k.i.a jaipur , jaipur","Contact No : 9352844505, 7877310890, , 9352844505",Contact Person : dharmpal bhuria
HIGHWAY RAJASTHAN ROADLINES,"road no 14vki near milan cinema delhi road. jaipur , jaipur","Contact No : 9314199192, 9314071365, 9314199192",Contact Person : himanshu yadav
RAHUL PACKERS & MOVERS,"2- road no.4 vki , jaipur","Contact No : 9462099193, 9314709267, , 9314709267",Contact Person : nk sharma
RAJESH MOTORS PVT. LTD.,"nh-08- behind agrawal petrol pump- ramchandrapura- jaipur , jaipur","Contact No : 9414057016, 0141, 3027676, 3027677,",Contact Person : amit sharma
KUNDANMAL MUKANMAL TRADERS PVT. LTD.,"d-80- chandpole- anaj mandi- jaipur , jaipur","Contact No : 9829014310, 2361785, 3261785,",Contact Person : NULL
SUPRABHAT ROAD CARRIER PVT. LTD.,"sansar chandra road- jaipur , jaipur","Contact No : 9414142552, 2375875, 2368415,",Contact Person : pradeep binani
ACS LOGISTICS,"murlipura , jaipur","Contact No : 9829084407, 09829084407,",Contact Person : sunil agarwal
RIDDI SIDDHI PACKERS & MOVERS,"a-3- bhura patel nagar- chitrakoot- vaishali nagar , jaipur","Contact No : 9352512365, 9928607588, ,",Contact Person : dalpat singh charan
GURJAR GOLDEN TEMPO TRANSPORT CORP.,"milan cinema ke pas- delhi bypass- road no-14-vki area , jaipur","Contact No : 9950151087, 9314658487, 9351287588, 0141, 6508788, 5042066,",Contact Person : puranmal gurjar
KS MOTOR PVT. LTD.,"m.i. road- jaipur , jaipur","Contact No : , ,",Contact Person : NULL
OM SHRINATH PACKERS & MOVERS,"43- ist floor jda- triveni shopping centre- gopalpura- jaipur , jaipur","Contact No : , ,",Contact Person : NULL
JAIPUR FREIGHT CARRIER PVT. LTD.,"a-54- sangam colony- vki area- road no.14- jaipur , jaipur","Contact No : 9887308926, 8094723917, ,",Contact Person : kuldeep singh
INLAND WORLD LOGISTICS PVT. LTD.,"pulander ji ka bagh- moti dungri road- jaipur , jaipur","Contact No : 9314486733, 9929769376, 2615016, 3230666,",Contact Person : subhash dabral
JAIPUR JHARIA ROADLINES,"a-5- transport nagar , jaipur","Contact No : 9414075148, 0141, 4037448, 2642196,",Contact Person : tejbhan singh
TUSHAR CARGO CARRIER PVT. LTD.,"opp. chitrakoot water tank- delhi ajmer byepass- jaipur , jaipur","Contact No : 8764247955, 9680569655, ,",Contact Person : akram bhai
AWAGAMAN PACKERS & MOVERS,"d-5- tagore nagar- satya colony- d-block- ajmer road- jaipur , jaipur","Contact No : 9929216063, 9214868132, ,",Contact Person : NULL
ECONOMIC LOGISTIC LIMITED,"b 19 tp nagar jaipur , jaipur","Contact No : 9351313574, 2640273, 9351313574",Contact Person : pholcand
JAIPUR GOODS CARRIER,"todi mode jaipur , jaipur","Contact No : 7372976683, , 7372976683",Contact Person : abhishek pareek
SHEKHAR LOGISTIC SOLUTION,"ajmer road jaipur , jaipur","Contact No : 8107788861, 1412250888, 8005745972",Contact Person : ishwar singh
JAIPUR DIMAPUR TRANSPORT CO.,"e-5 - tranasport nagar , jaipur","Contact No : 9414072371, 0141, 2640071, 2620307,",Contact Person : rajendra sethi
OM RELOCATIONS SERVICES PVT. LTD.,"b-6 plot no.536- sector2- chitrakoot scheme- near pratap stadium north gate- jaipur , jaipur","Contact No : 9414322584, 9252420123, 2350663,",Contact Person : NULL
TK CARGO,"new loha mandi road jaipur , jaipur","Contact No : 9462238337, , 9462238337",Contact Person : pradeep khardia
KAPOOR FREIGHT CARRIER PVT. LTD.,"kapoor chambers 23- transport nagar- jaipur , jaipur","Contact No : 9829266699, 9829266199, 5102276, 5101990,",Contact Person : sanjay kapoor
KHALERIA LOGISTICS PVT. LTD.,"ajmer bye pass- opp. chitrakoot water tank- jaipur nasik , jaipur","Contact No : 9373350106, 9890717753, ,",Contact Person : NULL
TRANSKING RELOCATION,"plot.no.426-rajni vihar heerapura jaipur , jaipur","Contact No : 9024225566, , 9024225566",Contact Person : deepak
GURJAR ROADLINES PVT. LTD.,"near sharma dharamkanta- icd concor- kanakpura- jaipur , jaipur","Contact No : 9414024400, 01, 02, 03, 6454401,",Contact Person : tej singh gurjar
GURJAR GOLDEN TRANSPORT COMPANY,"shop no 3 shiv nagar near badarana puliya delhi baypass road vkia jaipur , jaipur","Contact No : 9828299574, 9314299574, 9828299574",Contact Person : ramswaroop gurjar
KERALA CARGO MOVERS,"9/10- shankar nagar - road no.1- sikar road- murlipura - jaipur , jaipur","Contact No : 9352178368, 9351378368, , 9352178368",Contact Person : satveer singh
TESTFIRM,"jaipur , jaipur","Contact No : 9887003884, 1234567890, 9887003884",Contact Person : self
RIGHTWAYS PACKERS & MOVERS,"chomu pulia ambabari- jaipur , jaipur","Contact No : 9829011329, 9829535270, ,",Contact Person : navneet garg
LIBRA INTERNATIONAL PACKERS & MOVERS,"shop no.5- b-163- kanha vihar- 200ft. bypass- vaishali nagar- jaipur , jaipur","Contact No : 9610186319, 8432156445, ,",Contact Person : sukhvir choudhary
GOLDEN LOGISTICS PACKERS & MOVERS,"plot no.6- jeevan deep clny- road- no.14- vki area- jaipur , jaipur","Contact No : 7726034721, 9610017461, ,",Contact Person : kedar sharma
SANTOSH GILL EARTHMOVERS PVT. LTD.,"334- guru jambeswar nagar-a- vaishali nagar- jaipur , jaipur","Contact No : 9929107111, 4047357,",Contact Person : NULL
VRC LOGISTICS PVT. LTD.,"near milan cinema- road no.14- vkia- jaipur , jaipur","Contact No : 9351012625, 9352512625, ,",Contact Person : NULL
VEGA LOGISTICS PVT. LTD.,"d-10- transport nagar- jaipur , jaipur","Contact No : 9314648285, ,",Contact Person : moolchand kumavat
PASHUPATI ROAD CARRIER PVT. LTD.,"a-5- godara complex- road no.14- vki area- jaipur , jaipur","Contact No : 9636580028, 9309034534, ,",Contact Person : ved prakash gill
RAHUL PACKERS & MOVERS,"2- road no.4 vki , jaipur","Contact No : 9462099193, 9314709267, , 9314709267",Contact Person : nk sharma
CHAUTRBHUJ LOGISTICS PVT. LTD.,"s-67-rico complex -road no-14- vki area , jaipur","Contact No : 70733315577, ,",Contact Person : v.k. tiwari
CTS EXPRESS LOGISTICS PVT. LTD.,"f-253- road no.12- vki area- jaipur , jaipur","Contact No : 9314417847, 9950137888, ,",Contact Person : NULL
OMDEO PACKERS & MOVERS PVT. LTD.,"b 92 e- kanha vihar- 60ft road- bhura patel marg- near 200ft bypass- vaishali nagar , jaipur","Contact No : 9314439377, 9314413711, ,",Contact Person : daya nand singh
MANISH PACKERS & MOVERS,"8- basement- yadav market- near sbbj chowk- ajmer road- jaipur , jaipur","Contact No : 9352112365, 9351415123, ,",Contact Person : sarvan singh
SUPREME TRANSPORT SOLUTION PVT. LTD.,"diggi malpura road- near sawai madhopur railway line pulia sanganer- jaipur , jaipur","Contact No : 9314513075, 3107688, 3237767,",Contact Person : jp sharma
RAHUL PACKERS & MOVERS,"2- road no.4 vki , jaipur","Contact No : 9462099193, 9314709267, , 9314709267",Contact Person : nk sharma
HIND TRANSPORT CO. (REG),"milan cinema road- delhi bypass- road no-14-vki area , jaipur","Contact No : 9352969521, 8890067042, 9602857350, 9529869542, 0141, 2176150,",Contact Person : pradeep pareek
RAHUL PACKERS & MOVERS,"2- road no.4 vki , jaipur","Contact No : 9462099193, 9314709267, , 9314709267",Contact Person : nk sharma
TONGIA PACKERS & MOVERS P. LTD.,"e-441- lalkothi- jaipur , jaipur","Contact No : 9314503278, ,",Contact Person : NULL
SHRI SHYAM TRANSPORT COMPANY,"24 opp.road no.12 v.k.i. area sikar road , jaipur","Contact No : 9314631900, 9928038621, 8058031900, 9314968621, 9001000848, 9314631900",Contact Person : raviender khandelwal
R.R. LOGISTICS,"g-30 arg-group v.k.l road no.9 jaipur , jaipur","Contact No : 9461344470, 7413005454, 9950509956, 9950509956",Contact Person : rajkummar sharma
RDB AUTO SERVICE PVT. LTD.,"agra road- jaipur , jaipur","Contact No : , 0141, 3991303, 305, 2604290,",Contact Person : NULL
KERALA ROADWAYS P. LTD.,"shop no.24- mishra market- opp. govt. school- near sanganeri gate- agra road- jaipur , jaipur","Contact No : 9414722810, 9351985423, 9352570108, 9660221040, 3138939,",Contact Person : rajendra kumar
UJJAWAL INTERNATIONAL PACKERS & MOVERS,"l-4- g-2- chitrakoot scheme- vaishali nagar- jaipur , jaipur","Contact No : 9314031123, 3137121,",Contact Person : rk choudhary
AGARWAL MOVERS AND PACKER,"jhotwara industries , jaipur","Contact No : 9636908361, ,",Contact Person : pradeep
